{
  "schema_version": "qra.backtest_bundle/v1",
  "report": {
    "path": "datasets/strategy_report.html",
    "format": "quantstats_html"
  },
  "metadata": {
    "strategy_id": "ma-crossover-multi-share-pool",
    "strategy_version": "v1.2.0",
    "data_version": "db-snapshot-2026-09-18",
    "universe": [
      "600576.SH",
      "688273.SH",
      "603628.SH",
      "688329.SH",
      "688702.SH",
      "603333.SH",
      "600986.SH",
      "600475.SH",
      "603391.SH",
      "603073.SH",
      "600448.SH",
      "603072.SH",
      "688776.SH",
      "603776.SH",
      "688156.SH",
      "603137.SH",
      "603315.SH",
      "600075.SH",
      "603590.SH",
      "688237.SH",
      "688757.SH",
      "603879.SH",
      "688599.SH",
      "601279.SH",
      "600763.SH",
      "600765.SH",
      "600895.SH",
      "600929.SH",
      "601921.SH",
      "688568.SH",
      "600686.SH",
      "603515.SH",
      "688114.SH",
      "603658.SH",
      "600433.SH",
      "688159.SH",
      "688590.SH",
      "600416.SH",
      "603081.SH",
      "600162.SH",
      "600894.SH",
      "600479.SH",
      "603858.SH",
      "600136.SH",
      "688536.SH",
      "600736.SH",
      "605555.SH",
      "600369.SH",
      "688629.SH",
      "601117.SH",
      "600391.SH",
      "601858.SH",
      "603120.SH",
      "603733.SH",
      "600446.SH",
      "600893.SH",
      "603065.SH",
      "603927.SH",
      "605488.SH",
      "688813.SH",
      "600400.SH",
      "688260.SH",
      "601798.SH",
      "600808.SH",
      "601888.SH",
      "600095.SH",
      "600678.SH",
      "688062.SH",
      "600927.SH",
      "600327.SH",
      "601615.SH",
      "603948.SH",
      "600207.SH",
      "688259.SH",
      "688439.SH",
      "605268.SH",
      "603068.SH",
      "600742.SH",
      "600751.SH",
      "688197.SH",
      "600968.SH",
      "601577.SH",
      "601633.SH",
      "601096.SH",
      "600011.SH",
      "688707.SH",
      "688393.SH",
      "603019.SH",
      "688616.SH",
      "600323.SH",
      "605288.SH",
      "603995.SH",
      "600545.SH",
      "600104.SH",
      "601100.SH",
      "688317.SH",
      "600169.SH",
      "603293.SH",
      "601616.SH",
      "603788.SH",
      "688533.SH",
      "603725.SH",
      "600933.SH",
      "600892.SH",
      "600353.SH",
      "600539.SH",
      "601728.SH",
      "688279.SH",
      "603358.SH",
      "600241.SH",
      "605099.SH",
      "688401.SH",
      "600965.SH",
      "688013.SH",
      "600458.SH",
      "605198.SH",
      "603398.SH",
      "600265.SH",
      "600308.SH",
      "600098.SH",
      "603195.SH",
      "600523.SH",
      "688251.SH",
      "603193.SH",
      "603817.SH",
      "600455.SH",
      "603060.SH",
      "688168.SH",
      "600073.SH",
      "603281.SH",
      "688392.SH",
      "601789.SH",
      "600368.SH",
      "603798.SH",
      "603040.SH",
      "688635.SH",
      "601990.SH",
      "603248.SH",
      "688063.SH",
      "688712.SH",
      "600881.SH",
      "601012.SH",
      "600663.SH",
      "600638.SH",
      "605358.SH",
      "688381.SH",
      "600033.SH",
      "600760.SH",
      "603326.SH",
      "600845.SH",
      "601229.SH",
      "603898.SH",
      "688351.SH",
      "603566.SH",
      "600855.SH",
      "603192.SH",
      "601665.SH",
      "603123.SH",
      "603107.SH",
      "600710.SH",
      "603027.SH",
      "600215.SH",
      "688508.SH",
      "605167.SH",
      "605305.SH",
      "603305.SH",
      "688039.SH",
      "688781.SH",
      "688098.SH",
      "600795.SH",
      "600871.SH",
      "601958.SH",
      "600720.SH",
      "601006.SH",
      "603208.SH",
      "600975.SH",
      "688652.SH",
      "601377.SH",
      "600733.SH",
      "603980.SH",
      "688298.SH",
      "603156.SH",
      "601158.SH",
      "600187.SH",
      "603860.SH",
      "603456.SH",
      "688290.SH",
      "688485.SH",
      "603599.SH",
      "688657.SH",
      "600981.SH",
      "600692.SH",
      "688766.SH",
      "688049.SH",
      "600129.SH",
      "603018.SH",
      "600883.SH",
      "688161.SH",
      "600777.SH",
      "603058.SH",
      "600857.SH",
      "603012.SH",
      "603586.SH",
      "600503.SH",
      "603130.SH",
      "603600.SH",
      "601033.SH",
      "601128.SH",
      "601992.SH",
      "600328.SH",
      "601111.SH",
      "600219.SH",
      "600158.SH",
      "600987.SH",
      "603722.SH",
      "688518.SH",
      "603660.SH",
      "600126.SH",
      "600650.SH",
      "688143.SH",
      "688110.SH",
      "601512.SH",
      "603255.SH",
      "688683.SH",
      "688113.SH",
      "605155.SH",
      "688605.SH",
      "688016.SH",
      "603610.SH",
      "603310.SH",
      "600839.SH",
      "600865.SH",
      "600165.SH",
      "603766.SH",
      "600480.SH",
      "688050.SH",
      "600180.SH",
      "603888.SH",
      "688728.SH",
      "605179.SH",
      "600018.SH",
      "601208.SH",
      "603938.SH",
      "600880.SH",
      "600119.SH",
      "603017.SH",
      "600590.SH",
      "688021.SH",
      "603178.SH",
      "603102.SH",
      "603589.SH",
      "688448.SH",
      "600729.SH",
      "605178.SH",
      "688011.SH",
      "603373.SH",
      "688038.SH",
      "688278.SH",
      "603092.SH",
      "601628.SH",
      "688330.SH",
      "603880.SH",
      "688155.SH",
      "605298.SH",
      "688486.SH",
      "600210.SH",
      "603638.SH",
      "688285.SH",
      "688668.SH",
      "603116.SH",
      "688469.SH",
      "600525.SH",
      "688628.SH",
      "688775.SH",
      "603719.SH",
      "688370.SH",
      "688363.SH",
      "600234.SH",
      "605365.SH",
      "601878.SH",
      "600930.SH",
      "600292.SH",
      "603128.SH",
      "603559.SH",
      "600171.SH",
      "603180.SH",
      "688106.SH",
      "601118.SH",
      "688365.SH",
      "688619.SH",
      "688132.SH",
      "603127.SH",
      "688331.SH",
      "600250.SH",
      "601519.SH",
      "603190.SH",
      "603025.SH",
      "601568.SH",
      "601106.SH",
      "688336.SH",
      "688729.SH",
      "600790.SH",
      "603049.SH",
      "688795.SH",
      "688048.SH",
      "603922.SH",
      "688101.SH",
      "601003.SH",
      "600390.SH",
      "603583.SH",
      "688047.SH",
      "688081.SH",
      "601996.SH",
      "688648.SH",
      "603069.SH",
      "603630.SH",
      "688225.SH",
      "688137.SH",
      "688378.SH",
      "688075.SH",
      "600633.SH",
      "688252.SH",
      "600979.SH",
      "688262.SH",
      "601949.SH",
      "600628.SH",
      "601002.SH",
      "688758.SH",
      "688767.SH",
      "603823.SH",
      "605507.SH",
      "600211.SH",
      "601828.SH",
      "603666.SH",
      "600810.SH",
      "688765.SH",
      "603950.SH",
      "600559.SH",
      "688807.SH",
      "688503.SH",
      "603278.SH",
      "601390.SH",
      "605289.SH",
      "603822.SH",
      "600642.SH",
      "605338.SH",
      "603324.SH",
      "605598.SH",
      "688247.SH",
      "688327.SH",
      "605580.SH",
      "600884.SH",
      "600461.SH",
      "603336.SH",
      "600278.SH",
      "688480.SH",
      "600127.SH",
      "600844.SH",
      "603360.SH",
      "600202.SH",
      "688088.SH",
      "600757.SH",
      "600851.SH",
      "688091.SH",
      "603797.SH",
      "600143.SH",
      "600737.SH",
      "600156.SH",
      "603216.SH",
      "600398.SH",
      "603486.SH",
      "603021.SH",
      "603175.SH",
      "600999.SH",
      "603356.SH",
      "600409.SH",
      "688095.SH",
      "600173.SH",
      "603808.SH",
      "600420.SH",
      "688682.SH",
      "603320.SH",
      "603213.SH",
      "688801.SH",
      "688321.SH",
      "603713.SH",
      "605007.SH",
      "603616.SH",
      "601838.SH",
      "600026.SH",
      "688373.SH",
      "603969.SH",
      "600961.SH",
      "603059.SH",
      "688800.SH",
      "688623.SH",
      "603330.SH",
      "603155.SH",
      "688679.SH",
      "688531.SH",
      "601566.SH",
      "603010.SH",
      "600352.SH",
      "605100.SH",
      "600141.SH",
      "688626.SH",
      "601919.SH",
      "688236.SH",
      "688681.SH",
      "603288.SH",
      "600251.SH",
      "600809.SH",
      "600423.SH",
      "600012.SH",
      "688396.SH",
      "600699.SH",
      "688820.SH",
      "601018.SH",
      "600694.SH",
      "601116.SH",
      "601668.SH",
      "605180.SH",
      "603529.SH",
      "688270.SH",
      "688147.SH",
      "600408.SH",
      "603270.SH",
      "600673.SH",
      "603786.SH",
      "688348.SH",
      "603580.SH",
      "688499.SH",
      "600797.SH",
      "603062.SH",
      "688112.SH",
      "600177.SH",
      "688004.SH",
      "688083.SH",
      "603619.SH",
      "600238.SH",
      "605117.SH",
      "600216.SH",
      "600621.SH",
      "601777.SH",
      "600289.SH",
      "605259.SH",
      "688696.SH",
      "688232.SH",
      "603002.SH",
      "688292.SH",
      "603518.SH",
      "603928.SH",
      "600671.SH",
      "600593.SH",
      "603790.SH",
      "603527.SH",
      "600869.SH",
      "603587.SH",
      "600063.SH",
      "688561.SH",
      "600528.SH",
      "600579.SH",
      "688372.SH",
      "688217.SH",
      "603663.SH",
      "688335.SH",
      "603112.SH",
      "600148.SH",
      "603800.SH",
      "688567.SH",
      "601869.SH",
      "605499.SH",
      "601598.SH",
      "601162.SH",
      "688426.SH",
      "688797.SH",
      "603158.SH",
      "688182.SH",
      "600444.SH",
      "600150.SH",
      "601890.SH",
      "600491.SH",
      "688580.SH",
      "688177.SH",
      "603282.SH",
      "688680.SH",
      "603052.SH",
      "603826.SH",
      "603197.SH",
      "600167.SH",
      "688069.SH",
      "600208.SH",
      "688809.SH",
      "688659.SH",
      "600101.SH",
      "600506.SH",
      "601611.SH",
      "600109.SH",
      "600822.SH",
      "601077.SH",
      "688025.SH",
      "600612.SH",
      "688798.SH",
      "600662.SH",
      "603682.SH",
      "603126.SH",
      "603132.SH",
      "603312.SH",
      "688660.SH",
      "600803.SH",